{
  "schemaVersion": "v1",
  "blockId": "systemic-risk-lite",
  "title": "40 - Systemic Risk Lite",
  "generatedAt": "2026-01-11T12:35:52.440Z",
  "dataAt": "2026-01-09",
  "meta": {
    "status": "LIVE",
    "reason": "OK",
    "stalenessSec": 218152,
    "coveragePct": 100,
    "timezoneAssumption": "UTC",
    "dataAtDefinition": "Composite of macro risk and market stress",
    "latencyMs": 0,
    "itemsCount": 1
  },
  "data": {
    "items": [
      {
        "score": 55,
        "stressScore": 58,
        "macroScore": 50,
        "date": "2026-01-09"
      }
    ]
  }
}