{
  "schemaVersion": "v1",
  "blockId": "regime-fracture-alert",
  "title": "37 - Regime Fracture Alert",
  "generatedAt": "2026-01-10T13:37:22.566Z",
  "dataAt": "2026-01-09",
  "meta": {
    "status": "LIVE",
    "reason": "OK",
    "stalenessSec": 135442,
    "coveragePct": 100,
    "timezoneAssumption": "UTC",
    "dataAtDefinition": "Detects regime mismatches",
    "latencyMs": 0,
    "itemsCount": 1
  },
  "data": {
    "items": [
      {
        "regime": "neutral",
        "breadthDelta": 0,
        "avgRelativeStrength": 0.17599187819745604,
        "fracture": false,
        "date": "2026-01-09"
      }
    ]
  }
}