{
  "schemaVersion": "v1",
  "blockId": "inflation-pulse",
  "title": "03 - Inflation Pulse",
  "generatedAt": "2026-01-13T18:34:15.760Z",
  "dataAt": "2025-12-01",
  "meta": {
    "status": "LIVE",
    "reason": "OK",
    "stalenessSec": 3782055,
    "coveragePct": 100,
    "timezoneAssumption": "UTC",
    "dataAtDefinition": "FRED CPI latest monthly observation",
    "latencyMs": 159,
    "itemsCount": 1
  },
  "data": {
    "items": [
      {
        "series": "CPI",
        "value": 326.03,
        "yoyPct": 2.653312468710926,
        "date": "2025-12-01"
      }
    ]
  }
}